{"apiVersion":"nexa.dev/frontend-page-spec/v1","kind":"FrontendPageSpec","id":"core-permissions","titleKey":"core.permissions.title","mode":"collection","accessOperation":"list","route":{"path":"/system/permissions","name":"CorePermissions"},"menu":{"id":"core-permissions","titleKey":"core.permissions.title","order":60},"operations":[{"id":"list","role":"list","operationId":"core.iam.permission.list","contextBindings":[],"result":{"itemsPath":["Items"],"totalPath":["Total"],"rowKeyPath":["PermissionId"]},"pagination":{"mode":"offset","limitPath":["Limit"],"offsetPath":["Offset"],"totalPath":["Total"],"pageSize":20}}],"fields":[{"id":"keyword","labelKey":"core.common.keyword","surfaces":["search"],"control":"text","bindings":[{"operation":"list","direction":"request","path":["Keyword"]}]},{"id":"permission-id","labelKey":"core.permissions.permissionId","surfaces":["list"],"bindings":[{"operation":"list","direction":"response","path":["Items","PermissionId"]}]},{"id":"resource-code","labelKey":"core.permissions.resourceCode","surfaces":["list"],"bindings":[{"operation":"list","direction":"response","path":["Items","ResourceCode"]}]},{"id":"code","labelKey":"core.common.code","surfaces":["list"],"bindings":[{"operation":"list","direction":"response","path":["Items","Code"]}]},{"id":"name","labelKey":"core.common.name","surfaces":["list"],"bindings":[{"operation":"list","direction":"response","path":["Items","Name"]}]},{"id":"description","labelKey":"core.permissions.description","surfaces":["list"],"bindings":[{"operation":"list","direction":"response","path":["Items","Description"]}]},{"id":"status","labelKey":"core.common.status","surfaces":["search","list"],"control":"select","choices":[{"value":"enabled","labelKey":"core.status.enabled"},{"value":"disabled","labelKey":"core.status.disabled"}],"bindings":[{"operation":"list","direction":"request","path":["Status"]},{"operation":"list","direction":"response","path":["Items","Status"]}]}],"actions":[],"extensionPoints":[]}
