{"apiVersion":"nexa.dev/frontend-page-spec/v1","kind":"FrontendPageSpec","id":"core-roles","titleKey":"core.roles.title","mode":"collection","accessOperation":"list","route":{"path":"/system/roles","name":"CoreRoles"},"menu":{"id":"core-roles","titleKey":"core.roles.title","order":40},"operations":[{"id":"list","role":"list","operationId":"core.iam.role.list","contextBindings":[],"result":{"itemsPath":["Items"],"totalPath":["Total"],"rowKeyPath":["RoleId"]},"pagination":{"mode":"offset","limitPath":["Limit"],"offsetPath":["Offset"],"totalPath":["Total"],"pageSize":20}},{"id":"create","role":"action","operationId":"core.iam.role.create","contextBindings":[]},{"id":"update","role":"action","operationId":"core.iam.role.update","contextBindings":[]},{"id":"status","role":"action","operationId":"core.iam.role.status.update","contextBindings":[]},{"id":"permissions","role":"action","operationId":"core.iam.role.permissions.replace","contextBindings":[]},{"id":"menus","role":"action","operationId":"core.iam.role.menus.replace","contextBindings":[]},{"id":"permission-options","role":"options","operationId":"core.iam.permission.list","contextBindings":[],"result":{"itemsPath":["Items"],"totalPath":["Total"]},"pagination":{"mode":"offset","limitPath":["Limit"],"offsetPath":["Offset"],"totalPath":["Total"],"pageSize":100}},{"id":"menu-options","role":"options","operationId":"core.iam.menu.list","contextBindings":[],"result":{"itemsPath":["Items"],"totalPath":["Total"]},"pagination":{"mode":"offset","limitPath":["Limit"],"offsetPath":["Offset"],"totalPath":["Total"],"pageSize":100}}],"fields":[{"id":"keyword","labelKey":"core.common.keyword","surfaces":["search"],"control":"text","bindings":[{"operation":"list","direction":"request","path":["Keyword"]},{"operation":"permission-options","direction":"request","path":["Keyword"]},{"operation":"menu-options","direction":"request","path":["Keyword"]}]},{"id":"role-id","labelKey":"core.roles.roleId","surfaces":[],"bindings":[{"operation":"list","direction":"response","path":["Items","RoleId"]},{"operation":"update","direction":"request","path":["RoleId"]},{"operation":"status","direction":"request","path":["RoleId"]},{"operation":"permissions","direction":"request","path":["RoleId"]},{"operation":"menus","direction":"request","path":["RoleId"]}]},{"id":"code","labelKey":"core.common.code","surfaces":["list"],"control":"text","bindings":[{"operation":"list","direction":"response","path":["Items","Code"]},{"operation":"create","direction":"request","path":["Code"]}]},{"id":"name","labelKey":"core.common.name","surfaces":["list"],"control":"text","bindings":[{"operation":"list","direction":"response","path":["Items","Name"]},{"operation":"create","direction":"request","path":["Name"]},{"operation":"update","direction":"request","path":["Name"]}]},{"id":"status","labelKey":"core.common.status","surfaces":["search","list"],"control":"select","choices":[{"value":"enabled","labelKey":"core.status.enabled"},{"value":"disabled","labelKey":"core.status.disabled"}],"bindings":[{"operation":"list","direction":"request","path":["Status"]},{"operation":"list","direction":"response","path":["Items","Status"]},{"operation":"status","direction":"request","path":["Status"]},{"operation":"permission-options","direction":"request","path":["Status"]},{"operation":"menu-options","direction":"request","path":["Status"]}]},{"id":"managed","labelKey":"core.roles.managed","surfaces":["list"],"bindings":[{"operation":"list","direction":"response","path":["Items","Managed"]}]},{"id":"version","labelKey":"core.common.version","surfaces":[],"bindings":[{"operation":"list","direction":"response","path":["Items","Version"]},{"operation":"update","direction":"request","path":["ExpectedVersion"]},{"operation":"status","direction":"request","path":["ExpectedVersion"]},{"operation":"permissions","direction":"request","path":["ExpectedVersion"]},{"operation":"menus","direction":"request","path":["ExpectedVersion"]}]},{"id":"permission-codes","labelKey":"core.roles.permissions","surfaces":[],"control":"multi-select","options":{"operation":"permission-options","valuePath":["Code"],"labelPath":["Name"]},"bindings":[{"operation":"list","direction":"response","path":["Items","PermissionCodes"]},{"operation":"permissions","direction":"request","path":["PermissionCodes"]}]},{"id":"menu-codes","labelKey":"core.roles.menus","surfaces":[],"control":"multi-select","options":{"operation":"menu-options","valuePath":["Code"],"labelPath":["Name"]},"bindings":[{"operation":"list","direction":"response","path":["Items","MenuCodes"]},{"operation":"menus","direction":"request","path":["MenuCodes"]}]}],"actions":[{"id":"create","labelKey":"core.actions.create","operation":"create","effect":"create","fields":["code","name"],"placement":"toolbar"},{"id":"update","labelKey":"core.actions.update","operation":"update","effect":"update","fields":["name"],"placement":"row"},{"id":"status","labelKey":"core.actions.updateStatus","operation":"status","effect":"update","fields":["status"],"placement":"row"},{"id":"permissions","labelKey":"core.roles.replacePermissions","operation":"permissions","effect":"update","fields":["permission-codes"],"placement":"row"},{"id":"menus","labelKey":"core.roles.replaceMenus","operation":"menus","effect":"update","fields":["menu-codes"],"placement":"row"}],"extensionPoints":[]}
