{"apiVersion":"nexa.dev/frontend-page-spec/v1","kind":"FrontendPageSpec","id":"core-members","titleKey":"core.members.title","mode":"collection","accessOperation":"list","route":{"path":"/system/members","name":"CoreMembers"},"menu":{"id":"core-members","titleKey":"core.members.title","order":20},"operations":[{"id":"list","role":"list","operationId":"core.iam.member.list","contextBindings":[],"result":{"itemsPath":["Items"],"totalPath":["Total"],"rowKeyPath":["MemberId"]},"pagination":{"mode":"offset","limitPath":["Limit"],"offsetPath":["Offset"],"totalPath":["Total"],"pageSize":20}},{"id":"status","role":"action","operationId":"core.iam.member.status.update","contextBindings":[]},{"id":"roles","role":"action","operationId":"core.iam.member.roles.replace","contextBindings":[]},{"id":"role-options","role":"options","operationId":"core.iam.role.list","contextBindings":[],"result":{"itemsPath":["Items"],"totalPath":["Total"]},"pagination":{"mode":"offset","limitPath":["Limit"],"offsetPath":["Offset"],"totalPath":["Total"],"pageSize":100}}],"fields":[{"id":"keyword","labelKey":"core.common.keyword","surfaces":["search"],"control":"text","bindings":[{"operation":"list","direction":"request","path":["Keyword"]},{"operation":"role-options","direction":"request","path":["Keyword"]}]},{"id":"member-id","labelKey":"core.members.memberId","surfaces":[],"bindings":[{"operation":"list","direction":"response","path":["Items","MemberId"]},{"operation":"status","direction":"request","path":["MemberId"]},{"operation":"roles","direction":"request","path":["MemberId"]}]},{"id":"username","labelKey":"core.accounts.username","surfaces":["list"],"bindings":[{"operation":"list","direction":"response","path":["Items","Username"]}]},{"id":"email","labelKey":"core.accounts.email","surfaces":["list"],"bindings":[{"operation":"list","direction":"response","path":["Items","Email"]}]},{"id":"display-name","labelKey":"core.accounts.displayName","surfaces":["list"],"bindings":[{"operation":"list","direction":"response","path":["Items","DisplayName"]}]},{"id":"status","labelKey":"core.common.status","surfaces":["search","list"],"control":"select","choices":[{"value":"enabled","labelKey":"core.status.enabled"},{"value":"disabled","labelKey":"core.status.disabled"}],"bindings":[{"operation":"list","direction":"request","path":["Status"]},{"operation":"list","direction":"response","path":["Items","Status"]},{"operation":"status","direction":"request","path":["Status"]},{"operation":"role-options","direction":"request","path":["Status"]}]},{"id":"version","labelKey":"core.common.version","surfaces":[],"bindings":[{"operation":"list","direction":"response","path":["Items","Version"]},{"operation":"status","direction":"request","path":["ExpectedVersion"]},{"operation":"roles","direction":"request","path":["ExpectedVersion"]}]},{"id":"role-codes","labelKey":"core.members.roles","surfaces":[],"control":"multi-select","options":{"operation":"role-options","valuePath":["Code"],"labelPath":["Name"]},"bindings":[{"operation":"list","direction":"response","path":["Items","RoleCodes"]},{"operation":"roles","direction":"request","path":["RoleCodes"]}]}],"actions":[{"id":"status","labelKey":"core.actions.updateStatus","operation":"status","effect":"update","fields":["status"],"placement":"row"},{"id":"roles","labelKey":"core.members.replaceRoles","operation":"roles","effect":"update","fields":["role-codes"],"placement":"row"}],"extensionPoints":[]}
