{"apiVersion":"nexa.dev/frontend-page-spec/v1","kind":"FrontendPageSpec","id":"core-accounts","titleKey":"core.accounts.title","mode":"collection","accessOperation":"list","route":{"path":"/system/accounts","name":"CoreAccounts"},"menu":{"id":"core-accounts","titleKey":"core.accounts.title","order":10},"operations":[{"id":"list","role":"list","operationId":"core.iam.account.list","contextBindings":[],"result":{"itemsPath":["Items"],"totalPath":["Total"],"rowKeyPath":["AccountId"]},"pagination":{"mode":"offset","limitPath":["Limit"],"offsetPath":["Offset"],"totalPath":["Total"],"pageSize":20}},{"id":"status","role":"action","operationId":"core.iam.account.status.update","contextBindings":[]},{"id":"reset","role":"action","operationId":"core.iam.account.password.reset","contextBindings":[]}],"fields":[{"id":"keyword","labelKey":"core.common.keyword","surfaces":["search"],"control":"text","bindings":[{"operation":"list","direction":"request","path":["Keyword"]}]},{"id":"account-id","labelKey":"core.accounts.accountId","surfaces":[],"bindings":[{"operation":"list","direction":"response","path":["Items","AccountId"]},{"operation":"status","direction":"request","path":["AccountId"]},{"operation":"reset","direction":"request","path":["AccountId"]}]},{"id":"username","labelKey":"core.accounts.username","surfaces":["list"],"bindings":[{"operation":"list","direction":"response","path":["Items","Username"]}]},{"id":"email","labelKey":"core.accounts.email","surfaces":["list"],"bindings":[{"operation":"list","direction":"response","path":["Items","Email"]}]},{"id":"display-name","labelKey":"core.accounts.displayName","surfaces":["list"],"bindings":[{"operation":"list","direction":"response","path":["Items","DisplayName"]}]},{"id":"source-code","labelKey":"core.accounts.sourceCode","surfaces":["list"],"bindings":[{"operation":"list","direction":"response","path":["Items","SourceCode"]}]},{"id":"status","labelKey":"core.common.status","surfaces":["search","list"],"control":"select","choices":[{"value":"enabled","labelKey":"core.status.enabled"},{"value":"disabled","labelKey":"core.status.disabled"}],"bindings":[{"operation":"list","direction":"request","path":["Status"]},{"operation":"list","direction":"response","path":["Items","Status"]},{"operation":"status","direction":"request","path":["Status"]}]},{"id":"new-password","labelKey":"core.accounts.newPassword","surfaces":[],"control":"password","bindings":[{"operation":"reset","direction":"request","path":["NewPassword"]}]}],"actions":[{"id":"status","labelKey":"core.actions.updateStatus","operation":"status","effect":"update","fields":["status"],"placement":"row"},{"id":"reset","labelKey":"core.accounts.resetPassword","operation":"reset","effect":"update","fields":["new-password"],"placement":"row","confirmKey":"core.accounts.resetConfirm"}],"extensionPoints":[]}
