{"apiVersion":"nexa.dev/frontend-page-spec/v1","kind":"FrontendPageSpec","id":"quality-snapshot","titleKey":"quality.snapshot.title","mode":"singleton","accessOperation":"get","route":{"path":"/quality/snapshot","name":"QualitySnapshot"},"menu":{"id":"quality-snapshot","titleKey":"quality.snapshot.title","order":10},"operations":[{"id":"get","role":"get","operationId":"quality.snapshot.get","contextBindings":[],"result":{}}],"fields":[{"id":"api-version","labelKey":"quality.snapshot.apiVersion","surfaces":["detail"],"bindings":[{"operation":"get","direction":"response","path":["APIVersion"]}]},{"id":"kind","labelKey":"quality.snapshot.kind","surfaces":["detail"],"bindings":[{"operation":"get","direction":"response","path":["Kind"]}]},{"id":"source-profile","labelKey":"quality.snapshot.sourceProfile","surfaces":["detail"],"bindings":[{"operation":"get","direction":"response","path":["SourceProfile"]}]},{"id":"read-model-scope","labelKey":"quality.snapshot.readModelScope","surfaces":["detail"],"bindings":[{"operation":"get","direction":"response","path":["ReadModelScope"]}]},{"id":"revision","labelKey":"quality.snapshot.revision","surfaces":["detail"],"bindings":[{"operation":"get","direction":"response","path":["Revision"]}]},{"id":"requirements","labelKey":"quality.snapshot.requirements","surfaces":["detail"],"bindings":[{"operation":"get","direction":"response","path":["Requirements"]}],"columns":[{"id":"requirement","labelKey":"quality.requirement.requirement","path":["Requirement"]},{"id":"title","labelKey":"quality.requirement.title","path":["Title"]},{"id":"status","labelKey":"quality.requirement.status","path":["Status"]},{"id":"test-refs","labelKey":"quality.requirement.testRefs","path":["TestRefs"]},{"id":"evidence-refs","labelKey":"quality.requirement.evidenceRefs","path":["EvidenceRefs"]},{"id":"freeze-refs","labelKey":"quality.requirement.freezeRefs","path":["FreezeRefs"]},{"id":"freeze-status","labelKey":"quality.requirement.freezeStatus","path":["FreezeStatus"]},{"id":"gap-codes","labelKey":"quality.requirement.gapCodes","path":["GapCodes"]}]}],"actions":[],"extensionPoints":[]}
