{"apiVersion":"nexa.dev/frontend-page-spec/v1","kind":"FrontendPageSpec","id":"core-menus","titleKey":"core.menus.title","mode":"collection","accessOperation":"list","route":{"path":"/system/menus","name":"CoreMenus"},"menu":{"id":"core-menus","titleKey":"core.menus.title","order":50},"operations":[{"id":"list","role":"list","operationId":"core.iam.menu.list","contextBindings":[],"result":{"itemsPath":["Items"],"totalPath":["Total"],"rowKeyPath":["MenuId"]},"pagination":{"mode":"offset","limitPath":["Limit"],"offsetPath":["Offset"],"totalPath":["Total"],"pageSize":20}}],"fields":[{"id":"keyword","labelKey":"core.common.keyword","surfaces":["search"],"control":"text","bindings":[{"operation":"list","direction":"request","path":["Keyword"]}]},{"id":"menu-id","labelKey":"core.menus.menuId","surfaces":["list"],"bindings":[{"operation":"list","direction":"response","path":["Items","MenuId"]}]},{"id":"code","labelKey":"core.common.code","surfaces":["list"],"bindings":[{"operation":"list","direction":"response","path":["Items","Code"]}]},{"id":"parent-code","labelKey":"core.menus.parentCode","surfaces":["list"],"bindings":[{"operation":"list","direction":"response","path":["Items","ParentCode"]}]},{"id":"name","labelKey":"core.common.name","surfaces":["list"],"bindings":[{"operation":"list","direction":"response","path":["Items","Name"]}]},{"id":"path","labelKey":"core.menus.path","surfaces":["list"],"bindings":[{"operation":"list","direction":"response","path":["Items","Path"]}]},{"id":"component","labelKey":"core.menus.component","surfaces":["list"],"bindings":[{"operation":"list","direction":"response","path":["Items","Component"]}]},{"id":"icon","labelKey":"core.menus.icon","surfaces":["list"],"bindings":[{"operation":"list","direction":"response","path":["Items","Icon"]}]},{"id":"sort-order","labelKey":"core.menus.sortOrder","surfaces":["list"],"bindings":[{"operation":"list","direction":"response","path":["Items","SortOrder"]}]},{"id":"status","labelKey":"core.common.status","surfaces":["search","list"],"control":"select","choices":[{"value":"enabled","labelKey":"core.status.enabled"},{"value":"disabled","labelKey":"core.status.disabled"}],"bindings":[{"operation":"list","direction":"request","path":["Status"]},{"operation":"list","direction":"response","path":["Items","Status"]}]}],"actions":[],"extensionPoints":[]}
