{"apiVersion":"nexa.dev/frontend-page-spec/v1","kind":"FrontendPageSpec","id":"core-tenants","titleKey":"core.tenants.title","mode":"collection","accessOperation":"list","route":{"path":"/system/tenants","name":"CoreTenants"},"menu":{"id":"core-tenants","titleKey":"core.tenants.title","order":30},"operations":[{"id":"list","role":"list","operationId":"core.iam.tenant.list","contextBindings":[],"result":{"itemsPath":["Items"],"totalPath":["Total"],"rowKeyPath":["TenantId"]},"pagination":{"mode":"offset","limitPath":["Limit"],"offsetPath":["Offset"],"totalPath":["Total"],"pageSize":20}},{"id":"provision","role":"action","operationId":"core.iam.tenant.provision","contextBindings":[]},{"id":"update","role":"action","operationId":"core.iam.tenant.update","contextBindings":[]},{"id":"status","role":"action","operationId":"core.iam.tenant.status.update","contextBindings":[]},{"id":"account-options","role":"options","operationId":"core.iam.account.list","contextBindings":[],"result":{"itemsPath":["Items"],"totalPath":["Total"]},"pagination":{"mode":"offset","limitPath":["Limit"],"offsetPath":["Offset"],"totalPath":["Total"],"pageSize":100}}],"fields":[{"id":"keyword","labelKey":"core.common.keyword","surfaces":["search"],"control":"text","bindings":[{"operation":"list","direction":"request","path":["Keyword"]},{"operation":"account-options","direction":"request","path":["Keyword"]}]},{"id":"tenant-id","labelKey":"core.tenants.tenantId","surfaces":[],"bindings":[{"operation":"list","direction":"response","path":["Items","TenantId"]},{"operation":"update","direction":"request","path":["TenantId"]},{"operation":"status","direction":"request","path":["TenantId"]}]},{"id":"code","labelKey":"core.common.code","surfaces":["list"],"control":"text","bindings":[{"operation":"list","direction":"response","path":["Items","Code"]},{"operation":"provision","direction":"request","path":["Code"]}]},{"id":"name","labelKey":"core.common.name","surfaces":["list"],"control":"text","bindings":[{"operation":"list","direction":"response","path":["Items","Name"]},{"operation":"provision","direction":"request","path":["Name"]},{"operation":"update","direction":"request","path":["Name"]}]},{"id":"status","labelKey":"core.common.status","surfaces":["search","list"],"control":"select","choices":[{"value":"enabled","labelKey":"core.status.enabled"},{"value":"disabled","labelKey":"core.status.disabled"}],"bindings":[{"operation":"list","direction":"request","path":["Status"]},{"operation":"list","direction":"response","path":["Items","Status"]},{"operation":"status","direction":"request","path":["Status"]},{"operation":"account-options","direction":"request","path":["Status"]}]},{"id":"version","labelKey":"core.common.version","surfaces":[],"bindings":[{"operation":"list","direction":"response","path":["Items","Version"]},{"operation":"update","direction":"request","path":["ExpectedVersion"]},{"operation":"status","direction":"request","path":["ExpectedVersion"]}]},{"id":"initial-admin","labelKey":"core.tenants.initialAdmin","surfaces":[],"control":"select","options":{"operation":"account-options","valuePath":["AccountId"],"labelPath":["DisplayName"]},"bindings":[{"operation":"provision","direction":"request","path":["InitialAdminAccountId"]}]}],"actions":[{"id":"provision","labelKey":"core.tenants.provision","operation":"provision","effect":"create","fields":["code","name","initial-admin"],"placement":"toolbar"},{"id":"update","labelKey":"core.actions.update","operation":"update","effect":"update","fields":["name"],"placement":"row"},{"id":"status","labelKey":"core.actions.updateStatus","operation":"status","effect":"update","fields":["status"],"placement":"row"}],"extensionPoints":[]}
